{"algorithm":{"id":"pigloros.metric.binary-calibration","major":1},"family":"deletion-redaction","schema":"pigloros.metric-conformance.case.v2","subcases":[{"expect":{"blake3":"43bc89e539da4e935a5ffca3817ef1101a878c08fe845bf41a784f7968650f5d","kind":"result","record":"MTR1"},"id":"del.1a","member":{"blake3":"b77cf93446f8106bb6423566bbbdce8927c9e93d21466efc24f0bbd96b4467ac","bytes":123,"record":"MTI1"},"title":"Redacted and Unavailable records are excluded and counted: EvidenceMissing"},{"expect":{"blake3":"089e125bf70f90fcd34e07ac18b94ebaf240d63556a1aa6a4f26ba3154532c2f","kind":"result","record":"MTR1"},"id":"del.1b","member":{"blake3":"c84bf249d8ff7ae04141128d351f27988d2a77af2f329316569ec33df35ed4d6","bytes":108,"record":"MTI1"},"title":"Redacted records only: RedactedViews"},{"expect":{"blake3":"5d05a9f822147e557e8dc057c014b4093195a4d09b665b50bd7fbf65a84902fb","kind":"result","record":"MTR1"},"id":"del.2","member":{"blake3":"eeb6bf7e799379ae23c6a731c6880c8c1a370a6275ee35c2711eb4bce4035e03","bytes":93,"record":"MTI1"},"title":"every record Redacted: InsufficientSamples with RedactedViews"},{"expect":{"absent_marker":"synthetic-secret-canary-del3","blake3":"1b5ab87e2cc4426d50cf67846845fba84807292ed92557629841718c050a019d","kind":"result","record":"MTR1"},"id":"del.3","member":{"blake3":"1df0c73b5879eb0154941b1377175dd4251abb1bbe0ecad328a89299a0265946","bytes":147,"record":"MTI1"},"title":"a synthetic canary in entity_id never appears in MTR1"}]}
